{
  "format": "sovereign.scene",
  "schema_version": 1,
  "scene_id": "8d4684d6-93cd-5d04-a868-b4d839bafda7",
  "name": "First Light",
  "revision": 2,
  "region": {
    "cell": [0, 0, 0]
  },
  "asset_references": [],
  "active_camera": "98fcda69-2d02-5a08-af47-a01a10aa7dd6",
  "environment": {
    "ambient_color": [0.42, 0.3, 0.26],
    "ambient_intensity": 0.22,
    "background_color": [0.004, 0.0035, 0.005],
    "fog_color": [0.035, 0.02, 0.018],
    "fog_density": 0.018,
    "exposure": 1.1
  },
  "entities": [
    {
      "id": "112b12dd-9bb3-5186-9e24-c12fcf54bfb9",
      "name": "Column E1",
      "components": {
        "transform": {
          "parent": null,
          "position": [5.5, 0.0, -8.0],
          "rotation": [0.0, 0.0, 0.0, 1.0],
          "scale": [1.0, 1.0, 1.0]
        }
      }
    },
    {
      "id": "1298a82a-2231-57dd-a713-9c28be5ebe3f",
      "name": "Walkway Light Strip (East)",
      "components": {
        "transform": {
          "parent": null,
          "position": [2.25, 0.012, 1.5],
          "rotation": [0.0, 0.0, 0.0, 1.0],
          "scale": [0.06, 0.024, 23.0]
        },
        "primitive_mesh": {
          "shape": "box"
        },
        "material": {
          "base_color": [0.08, 0.04, 0.01],
          "roughness": 0.5,
          "metallic": 0.0,
          "emissive": [1.0, 0.45, 0.08],
          "emissive_strength": 1.6
        }
      }
    },
    {
      "id": "16877fb2-97b9-53ca-822b-31b8397479cd",
      "name": "Column E1 Capital",
      "components": {
        "transform": {
          "parent": "112b12dd-9bb3-5186-9e24-c12fcf54bfb9",
          "position": [0.0, 7.85, 0.0],
          "rotation": [0.0, 0.0, 0.0, 1.0],
          "scale": [1.5, 0.5, 1.5]
        },
        "primitive_mesh": {
          "shape": "box"
        },
        "material": {
          "base_color": [0.48, 0.29, 0.12],
          "roughness": 0.32,
          "metallic": 1.0,
          "emissive": [0.0, 0.0, 0.0],
          "emissive_strength": 0.0
        }
      }
    },
    {
      "id": "1b4c4755-6e5e-5def-b40c-95a322d8084d",
      "name": "Column W3 Base",
      "components": {
        "transform": {
          "parent": "797ba59f-6819-5db3-8f4d-8823a5891825",
          "position": [0.0, 0.3, 0.0],
          "rotation": [0.0, 0.0, 0.0, 1.0],
          "scale": [1.6, 0.6, 1.6]
        },
        "primitive_mesh": {
          "shape": "box"
        },
        "material": {
          "base_color": [0.03, 0.03, 0.034],
          "roughness": 0.85,
          "metallic": 0.0,
          "emissive": [0.0, 0.0, 0.0],
          "emissive_strength": 0.0
        }
      }
    },
    {
      "id": "1d1d9327-ebdc-546f-93e6-57ded1a720ed",
      "name": "Column E4",
      "components": {
        "transform": {
          "parent": null,
          "position": [5.5, 0.0, 4.0],
          "rotation": [0.0, 0.0, 0.0, 1.0],
          "scale": [1.0, 1.0, 1.0]
        }
      }
    },
    {
      "id": "1d75e66e-cb39-5d49-8e9c-8ec7428ffa24",
      "name": "Column E6 Capital",
      "components": {
        "transform": {
          "parent": "97bed9e8-b320-594d-a781-9e375023f34e",
          "position": [0.0, 7.85, 0.0],
          "rotation": [0.0, 0.0, 0.0, 1.0],
          "scale": [1.5, 0.5, 1.5]
        },
        "primitive_mesh": {
          "shape": "box"
        },
        "material": {
          "base_color": [0.48, 0.29, 0.12],
          "roughness": 0.32,
          "metallic": 1.0,
          "emissive": [0.0, 0.0, 0.0],
          "emissive_strength": 0.0
        }
      }
    },
    {
      "id": "1dc3879e-9648-559e-b3a9-e1d9e1d468ec",
      "name": "Column W1 Capital",
      "components": {
        "transform": {
          "parent": "9949acb1-9986-5162-b619-52e51af32e47",
          "position": [0.0, 7.85, 0.0],
          "rotation": [0.0, 0.0, 0.0, 1.0],
          "scale": [1.5, 0.5, 1.5]
        },
        "primitive_mesh": {
          "shape": "box"
        },
        "material": {
          "base_color": [0.48, 0.29, 0.12],
          "roughness": 0.32,
          "metallic": 1.0,
          "emissive": [0.0, 0.0, 0.0],
          "emissive_strength": 0.0
        }
      }
    },
    {
      "id": "228ac414-5869-5518-b407-e82353c8cafb",
      "name": "Column W1 Shaft",
      "components": {
        "transform": {
          "parent": "9949acb1-9986-5162-b619-52e51af32e47",
          "position": [0.0, 4.1, 0.0],
          "rotation": [0.0, 0.0, 0.0, 1.0],
          "scale": [0.9, 7.0, 0.9]
        },
        "primitive_mesh": {
          "shape": "cylinder"
        },
        "material": {
          "base_color": [0.22, 0.03, 0.03],
          "roughness": 0.4,
          "metallic": 0.0,
          "emissive": [0.0, 0.0, 0.0],
          "emissive_strength": 0.0
        }
      }
    },
    {
      "id": "2e7fa1d0-b3e0-5939-a134-c8a75a58e198",
      "name": "Column W4 Band",
      "components": {
        "transform": {
          "parent": "7fef6493-efce-5317-a904-81f1704a7627",
          "position": [0.0, 2.2, 0.0],
          "rotation": [0.0, 0.0, 0.0, 1.0],
          "scale": [0.96, 0.12, 0.96]
        },
        "primitive_mesh": {
          "shape": "cylinder"
        },
        "material": {
          "base_color": [0.08, 0.04, 0.01],
          "roughness": 0.5,
          "metallic": 0.0,
          "emissive": [1.0, 0.45, 0.08],
          "emissive_strength": 1.6
        }
      }
    },
    {
      "id": "30e6248b-5eb4-581b-b0f7-aad817a025cb",
      "name": "Column W2 Band",
      "components": {
        "transform": {
          "parent": "40dc947e-18d5-5e30-94d6-c3deb1ea9bc1",
          "position": [0.0, 2.2, 0.0],
          "rotation": [0.0, 0.0, 0.0, 1.0],
          "scale": [0.96, 0.12, 0.96]
        },
        "primitive_mesh": {
          "shape": "cylinder"
        },
        "material": {
          "base_color": [0.08, 0.04, 0.01],
          "roughness": 0.5,
          "metallic": 0.0,
          "emissive": [1.0, 0.45, 0.08],
          "emissive_strength": 1.6
        }
      }
    },
    {
      "id": "31bb8276-ad0d-5e77-b103-23474c896136",
      "name": "Column E2 Base",
      "components": {
        "transform": {
          "parent": "fbab1857-2f62-543e-8992-f121d66a121f",
          "position": [0.0, 0.3, 0.0],
          "rotation": [0.0, 0.0, 0.0, 1.0],
          "scale": [1.6, 0.6, 1.6]
        },
        "primitive_mesh": {
          "shape": "box"
        },
        "material": {
          "base_color": [0.03, 0.03, 0.034],
          "roughness": 0.85,
          "metallic": 0.0,
          "emissive": [0.0, 0.0, 0.0],
          "emissive_strength": 0.0
        }
      }
    },
    {
      "id": "3393e93f-398f-5eb9-806b-033a778b62f4",
      "name": "Column W6",
      "components": {
        "transform": {
          "parent": null,
          "position": [-5.5, 0.0, 12.0],
          "rotation": [0.0, 0.0, 0.0, 1.0],
          "scale": [1.0, 1.0, 1.0]
        }
      }
    },
    {
      "id": "34616f0f-c80d-5d75-937d-e0687599cbc6",
      "name": "Column W5 Capital",
      "components": {
        "transform": {
          "parent": "c3229905-b9b5-5514-92ad-455988c6c3f4",
          "position": [0.0, 7.85, 0.0],
          "rotation": [0.0, 0.0, 0.0, 1.0],
          "scale": [1.5, 0.5, 1.5]
        },
        "primitive_mesh": {
          "shape": "box"
        },
        "material": {
          "base_color": [0.48, 0.29, 0.12],
          "roughness": 0.32,
          "metallic": 1.0,
          "emissive": [0.0, 0.0, 0.0],
          "emissive_strength": 0.0
        }
      }
    },
    {
      "id": "3cb46d24-c32a-506d-9ced-7c50060ad859",
      "name": "Dais Step (Upper)",
      "components": {
        "transform": {
          "parent": null,
          "position": [0.0, 0.4, -9.2],
          "rotation": [0.0, 0.0, 0.0, 1.0],
          "scale": [7.0, 0.8, 0.7]
        },
        "primitive_mesh": {
          "shape": "box"
        },
        "material": {
          "base_color": [0.03, 0.03, 0.034],
          "roughness": 0.85,
          "metallic": 0.0,
          "emissive": [0.0, 0.0, 0.0],
          "emissive_strength": 0.0
        }
      }
    },
    {
      "id": "3cb47153-023e-5e09-9fa3-39eddd5df8a7",
      "name": "Column E4 Shaft",
      "components": {
        "transform": {
          "parent": "1d1d9327-ebdc-546f-93e6-57ded1a720ed",
          "position": [0.0, 4.1, 0.0],
          "rotation": [0.0, 0.0, 0.0, 1.0],
          "scale": [0.9, 7.0, 0.9]
        },
        "primitive_mesh": {
          "shape": "cylinder"
        },
        "material": {
          "base_color": [0.22, 0.03, 0.03],
          "roughness": 0.4,
          "metallic": 0.0,
          "emissive": [0.0, 0.0, 0.0],
          "emissive_strength": 0.0
        }
      }
    },
    {
      "id": "40dc947e-18d5-5e30-94d6-c3deb1ea9bc1",
      "name": "Column W2",
      "components": {
        "transform": {
          "parent": null,
          "position": [-5.5, 0.0, -4.0],
          "rotation": [0.0, 0.0, 0.0, 1.0],
          "scale": [1.0, 1.0, 1.0]
        }
      }
    },
    {
      "id": "41edb1a1-c6ee-5809-bba3-527b6a9bce77",
      "name": "Column W2 Shaft",
      "components": {
        "transform": {
          "parent": "40dc947e-18d5-5e30-94d6-c3deb1ea9bc1",
          "position": [0.0, 4.1, 0.0],
          "rotation": [0.0, 0.0, 0.0, 1.0],
          "scale": [0.9, 7.0, 0.9]
        },
        "primitive_mesh": {
          "shape": "cylinder"
        },
        "material": {
          "base_color": [0.22, 0.03, 0.03],
          "roughness": 0.4,
          "metallic": 0.0,
          "emissive": [0.0, 0.0, 0.0],
          "emissive_strength": 0.0
        }
      }
    },
    {
      "id": "433ba49c-7ba0-59be-bdba-fbdc4b357f29",
      "name": "Column E2 Band",
      "components": {
        "transform": {
          "parent": "fbab1857-2f62-543e-8992-f121d66a121f",
          "position": [0.0, 2.2, 0.0],
          "rotation": [0.0, 0.0, 0.0, 1.0],
          "scale": [0.96, 0.12, 0.96]
        },